{
  "schemaVersion": "mindclade.dev/scientific-model-intake/v1",
  "intakeId": "scientific-candidate",
  "purpose": "implementation-authorization",
  "targetCard": {"digest": "sha256:1111111111111111111111111111111111111111111111111111111111111111", "size_bytes": 2048, "media_type": "application/vnd.mindclade.model-target-card+json", "logical_kind": "model-target-card", "schema_version": 2},
  "scientificSemantics": {"digest": "sha256:2222222222222222222222222222222222222222222222222222222222222222", "size_bytes": 4096, "media_type": "application/vnd.mindclade.scientific-semantics+json", "logical_kind": "scientific-semantics", "schema_version": 1},
  "preprocessingContract": {"digest": "sha256:3333333333333333333333333333333333333333333333333333333333333333", "size_bytes": 1024, "media_type": "application/vnd.mindclade.preprocessing-contract+json", "logical_kind": "preprocessing-contract", "schema_version": 1},
  "checkpointContract": {"digest": "sha256:4444444444444444444444444444444444444444444444444444444444444444", "size_bytes": 1024, "media_type": "application/vnd.mindclade.checkpoint-contract+json", "logical_kind": "checkpoint-contract", "schema_version": 1},
  "referenceVectorPack": {"digest": "sha256:5555555555555555555555555555555555555555555555555555555555555555", "size_bytes": 8192, "media_type": "application/vnd.mindclade.reference-vector-pack+tar", "logical_kind": "reference-vector-pack", "schema_version": 1},
  "trainingDatasets": [
    {"digest": "sha256:6666666666666666666666666666666666666666666666666666666666666666", "size_bytes": 2048, "media_type": "application/vnd.mindclade.dataset-manifest+json", "logical_kind": "dataset-manifest", "schema_version": 1}
  ],
  "evaluationDatasets": [
    {"digest": "sha256:7777777777777777777777777777777777777777777777777777777777777777", "size_bytes": 2048, "media_type": "application/vnd.mindclade.dataset-manifest+json", "logical_kind": "dataset-manifest", "schema_version": 1}
  ],
  "evaluationPolicy": {"digest": "sha256:8888888888888888888888888888888888888888888888888888888888888888", "size_bytes": 2048, "media_type": "application/vnd.mindclade.evaluation-policy+json", "logical_kind": "evaluation-policy", "schema_version": 1},
  "servingContract": {"digest": "sha256:9999999999999999999999999999999999999999999999999999999999999999", "size_bytes": 2048, "media_type": "application/vnd.mindclade.serving-contract+json", "logical_kind": "serving-contract", "schema_version": 1},
  "runtimeConsumers": [
    {"digest": "sha256:aaaaaaaaaaaaaaaaaaaaaaaaaaaaaaaaaaaaaaaaaaaaaaaaaaaaaaaaaaaaaaaa", "size_bytes": 2048, "media_type": "application/vnd.mindclade.serving-runtime-contract+json", "logical_kind": "serving-runtime-contract", "schema_version": 1}
  ],
  "safetyUsePolicy": {"digest": "sha256:bbbbbbbbbbbbbbbbbbbbbbbbbbbbbbbbbbbbbbbbbbbbbbbbbbbbbbbbbbbbbbbb", "size_bytes": 2048, "media_type": "application/vnd.mindclade.safety-use-policy+json", "logical_kind": "safety-use-policy", "schema_version": 1},
  "sourceRevision": "0123456789abcdef0123456789abcdef01234567",
  "policyDigest": "sha256:abababababababababababababababababababababababababababababababab",
  "biosecurityReviewRequired": false,
  "approvals": [
    {"role": "data", "subjectDigest": "sha256:1111111111111111111111111111111111111111111111111111111111111111", "attestation": {"digest": "sha256:1010101010101010101010101010101010101010101010101010101010101010", "size_bytes": 512, "media_type": "application/vnd.mindclade.scientific-intake-attestation+json", "logical_kind": "scientific-intake-attestation", "schema_version": 1}},
    {"role": "evaluation-training", "subjectDigest": "sha256:1111111111111111111111111111111111111111111111111111111111111111", "attestation": {"digest": "sha256:1212121212121212121212121212121212121212121212121212121212121212", "size_bytes": 512, "media_type": "application/vnd.mindclade.scientific-intake-attestation+json", "logical_kind": "scientific-intake-attestation", "schema_version": 1}},
    {"role": "modeling", "subjectDigest": "sha256:1111111111111111111111111111111111111111111111111111111111111111", "attestation": {"digest": "sha256:1313131313131313131313131313131313131313131313131313131313131313", "size_bytes": 512, "media_type": "application/vnd.mindclade.scientific-intake-attestation+json", "logical_kind": "scientific-intake-attestation", "schema_version": 1}},
    {"role": "platform-control", "subjectDigest": "sha256:1111111111111111111111111111111111111111111111111111111111111111", "attestation": {"digest": "sha256:1414141414141414141414141414141414141414141414141414141414141414", "size_bytes": 512, "media_type": "application/vnd.mindclade.scientific-intake-attestation+json", "logical_kind": "scientific-intake-attestation", "schema_version": 1}},
    {"role": "release", "subjectDigest": "sha256:1111111111111111111111111111111111111111111111111111111111111111", "attestation": {"digest": "sha256:1515151515151515151515151515151515151515151515151515151515151515", "size_bytes": 512, "media_type": "application/vnd.mindclade.scientific-intake-attestation+json", "logical_kind": "scientific-intake-attestation", "schema_version": 1}},
    {"role": "runtime", "subjectDigest": "sha256:1111111111111111111111111111111111111111111111111111111111111111", "attestation": {"digest": "sha256:1616161616161616161616161616161616161616161616161616161616161616", "size_bytes": 512, "media_type": "application/vnd.mindclade.scientific-intake-attestation+json", "logical_kind": "scientific-intake-attestation", "schema_version": 1}},
    {"role": "security", "subjectDigest": "sha256:1111111111111111111111111111111111111111111111111111111111111111", "attestation": {"digest": "sha256:1717171717171717171717171717171717171717171717171717171717171717", "size_bytes": 512, "media_type": "application/vnd.mindclade.scientific-intake-attestation+json", "logical_kind": "scientific-intake-attestation", "schema_version": 1}}
  ]
}
